[
  {
    "id": "svinoj-shashlyk-v-duhovke-na-shpazhkah",
    "title": "Свиной шашлык в духовке на шпажках",
    "source_type": "article",
    "source_url": "",
    "source_name": "Личный опыт",
    "tags": [
      "духовка",
      "шашлык",
      "шпажки",
      "мангал"
    ],
    "category": "свинина",
    "summary": "Шашлык из свиной шеи в маринаде из лука и газированной минеральной воды — без кефира и кислоты, адаптирован для запекания в духовке без решётки: мясо подвешивается на шпажках над противнем, чтобы жир и сок стекали вниз, а не тушили кусок. Рассчитан на 5 персон.",
    "ingredients": [
      {
        "name": "свиная шея (ошеек)",
        "amount": 2,
        "unit": "кг",
        "detail": "нарезать кубиками 4×4 см",
        "scalable": true
      },
      {
        "name": "минеральная вода сильногазированная",
        "amount": 400,
        "unit": "мл",
        "scalable": true
      },
      {
        "name": "лук",
        "amount": 1,
        "unit": "кг",
        "detail": "часть кольцами, часть раздавить руками с солью",
        "scalable": true
      },
      {
        "name": "растительное масло",
        "amount": 2,
        "unit": "ст. л.",
        "scalable": true
      },
      {
        "name": "соль",
        "amount": 1.5,
        "unit": "ч. л.",
        "detail": "по вкусу, добавить ещё после маринования",
        "scalable": true
      },
      {
        "name": "чёрный перец свежемолотый",
        "amount": 1,
        "unit": "ч. л.",
        "scalable": true
      }
    ],
    "steps": [
      "Нарежьте мясо кубиками ~4×4 см — крупнее, чем кажется нужным, иначе середина не успеет прожариться, а края пересохнут.",
      "Лук нарежьте кольцами, треть раздавите руками с щепоткой соли, чтобы пустил сок — это даст луковую «базу» отдельно от жидкости.",
      "Смешайте мясо, лук, соль, перец, масло — дайте постоять 15 минут без жидкости, чтобы специи и масло схватились за поверхность.",
      "Залейте минеральной водой до половины объёма мяса, не нужно утоплять полностью. Уберите в холод на 6–12 часов (можно на ночь без риска — здесь нет кислоты, которая «варит» мясо).",
      "Перед нанизыванием стряхните лишний маринад и кусочки лука с мяса — мокрая поверхность даст пар вместо корочки, а подгоревший лук на шпажке горчит.",
      "Наденьте мясо на деревянные или металлические шпажки плотно, без зазоров, куски одинакового размера.",
      "Возьмите глубокий противень или форму для запекания и положите шпажки поперёк, чтобы концы опирались на края, а мясо висело в воздухе над дном. Если шпажки короче формы — используйте две одинаковые формы рядом. Деревянные шпажки замочите на 10–15 минут там, где они будут торчать наружу.",
      "Разогрейте духовку до 220–230°C, конвекция + верхний нагрев (гриль), если есть.",
      "Готовьте 15–20 минут, один раз перевернув шпажки для равномерного подрумянивания с двух сторон.",
      "В последние 5–7 минут включите гриль на максимум и переместите форму выше, ближе к нагревательному элементу — это даст корочку, имитирующую жарку на углях.",
      "Проверьте готовность термощупом — 68–70°C в центре куска (шея жирная, эта температура не пересушит).",
      "Снимите, дайте 3–4 минуты отдохнуть под фольгой перед подачей."
    ],
    "variations": [
      {
        "title": "Маринад с шампанским и горчицей",
        "text": "<p>Замените минеральную воду на 300–400 мл несладкого белого шампанского и добавьте 1,5–2 ст. л. дижонской горчицы. Горчицу сначала размешайте с маслом до однородности, затем добавьте к мясу и луку, и только потом залейте шампанским — так она равномерно распределится, а не осядет комками в жидкости.</p><p>В отличие от минералки, у шампанского есть настоящая кислотность — <strong>маринуйте строго 4–6 часов, не дольше</strong>. При более длительном контакте поверхность мяса становится рыхлой и суховатой при жарке.</p><p>Перед нанизыванием обязательно дайте мясу стечь на дуршлаге 5–10 минут и обсушите.</p>"
      },
      {
        "title": "С дымным ароматом — щепа и жидкий дым",
        "text": "<p>Если хочется приблизить вкус к настоящему мангалу, добавьте дымный акцент прямо в духовке:</p><p><strong>Щепа в фольге:</strong> замочите горсть щепы (яблоня, вишня, дуб) в воде на 15 минут, отожмите, заверните в фольгу и сделайте несколько проколов сверху. Положите пакет на дно духовки или на отдельный маленький противень под шпажками в первые 10–15 минут готовки — щепа начнёт тлеть и даст лёгкий дым. Духовка должна быть хорошо проветриваемой после — запах держится долго.</p><p><strong>Жидкий дым:</strong> проще и без риска — за 10 минут до конца готовки слегка кисточкой пройдитесь по мясу несколькими каплями жидкого дыма, разведёнными в 1 ст. л. воды. Не переборщите — вкус концентрированный и легко забивает мясо.</p><p><strong>Копчёная паприка:</strong> самый мягкий вариант — добавьте 0,5 ч. л. копчёной паприки в маринад изначально или присыпьте мясо перед финальным этапом с грилем. Аромата меньше, чем от щепы, но и риска пересолить вкус дымом нет.</p>"
      }
    ],
    "notes": "Способ со шпажками над формой — рабочая альтернатива решётке для духовок без гриль-решётки: жир и сок капают вниз, кусок не тушится в собственной жидкости. Если шпажек не хватает, можно положить мясо на скомканные шарики фольги как подставки, но результат хуже, чем при полном подвешивании. Термощуп предпочтительнее визуальной проверки — в духовке степень прожарки на глаз оценить сложнее, чем на углях.",
    "added": "2026-07-27"
  },
  {
    "id": "svinnaya-sheya-zapechennaya-s-paprikoj",
    "title": "Свиная шея, запечённая с паприкой",
    "summary": "Бюджетный кусок свиной шеи около 1 кг запекается при 180°C до внутренней температуры не ниже 71°C. Соль по возможности заранее, после духовки отдых 10 минут под фольгой. Чеснок, паприка и лук из кладовой.",
    "tags": [
      "духовка",
      "бюджет",
      "ужин"
    ],
    "ingredients": [
      {
        "name": "кусок свиной шеи",
        "amount": 1000,
        "amount_max": 1200,
        "unit": "г",
        "detail": "целый, не премиум-стейк",
        "scalable": true,
        "scale_mode": "linear"
      },
      {
        "name": "лук",
        "amount": 2,
        "unit": "шт",
        "detail": "крупный, дольками"
      },
      {
        "name": "чеснок",
        "amount": 4,
        "unit": "зубчик",
        "detail": "раздавить или мелко нарезать",
        "scalable": false
      },
      {
        "name": "паприка",
        "amount": 2,
        "unit": "ч. л.",
        "scalable": false
      },
      {
        "name": "растительное масло",
        "amount": 2,
        "unit": "ст. л."
      },
      {
        "name": "соль",
        "scalable": false
      },
      {
        "name": "чёрный перец",
        "scalable": false
      }
    ],
    "steps": [
      {
        "text": "Разогреть духовку до 180°C."
      },
      {
        "text": "Обсушить кусок, натереть растительным маслом, чёрным перцем, паприкой и чесноком."
      },
      {
        "text": "Выложить дольки лука на противень, сверху положить мясо."
      },
      {
        "text": "Запекать около 70–90 минут, пока термометр в центре самого толстого места не покажет не ниже 71°C.",
        "timer_min": 80,
        "timer_label": "Запекание",
        "timer_note": "Внутренняя температура: 71°C"
      },
      {
        "text": "Накрыть кусок фольгой и дать отдохнуть 10 минут, затем нарезать.",
        "timer_min": 10,
        "timer_label": "Отдых под фольгой"
      }
    ],
    "notes": "Берите обычную шею или лопатку из супермаркета. Мраморные премиум-стейки для этого рецепта не нужны. URL источника не выдумывался.\n\nСоль заранее: Если посолить кусок хотя бы за пару часов, соль успеет разойтись, и корочка получится ровнее. В день готовки солить тоже можно, но вкус будет проще.\n\nПилот sol-chef: B02-pork-budget-roast, pipeline-A, оценка 4.86",
    "added": "2026-09-05",
    "category": "свинина",
    "source_type": "article",
    "source_url": "",
    "source_name": "Pilot source notes B02",
    "prep": [
      {
        "text": "Натереть свиную шею солью со всех сторон и убрать в холодильник минимум на 2 часа, лучше на ночь.",
        "before_hours": 2,
        "type": "fridge"
      }
    ],
    "variations": [
      {
        "title": "Лопатка тем же способом",
        "text": "Вместо шеи взять свиную лопатку того же веса: время в духовке может быть чуть дольше, критерий готовности тот же — не ниже 71°C внутри, затем отдых 10 минут."
      }
    ]
  }
]
