[
  {
    "id": "kurinaya-grudka-na-skovorode-s-paprikoy",
    "title": "Куриная грудка на сковороде с паприкой",
    "summary": "Куриная грудка с чесноком и паприкой, приготовленная на сильном огне и обязательно проверенная термометром до безопасной внутренней температуры.",
    "tags": [
      "курица",
      "сковорода",
      "быстрый ужин"
    ],
    "ingredients": [
      {
        "name": "Куриная грудка",
        "amount": 500,
        "unit": "г",
        "detail": "без кости",
        "scalable": true,
        "scale_mode": "linear"
      },
      {
        "name": "Растительное масло",
        "amount": 1,
        "unit": "ст. л.",
        "scalable": true,
        "scale_mode": "gentle"
      },
      {
        "name": "Чеснок",
        "amount": 2,
        "unit": "зубчик",
        "scalable": true,
        "scale_mode": "gentle"
      },
      {
        "name": "Паприка",
        "amount": 1,
        "unit": "ч. л.",
        "scalable": true,
        "scale_mode": "gentle"
      },
      {
        "name": "Соль",
        "scalable": false
      },
      {
        "name": "Чёрный перец",
        "scalable": false
      }
    ],
    "steps": [
      {
        "text": "Разрезать куриную грудку вдоль на пласты равномерной толщины, посолить, поперчить и посыпать паприкой; чеснок измельчить."
      },
      {
        "text": "Разогреть сковороду с растительным маслом на сильном огне. Выложить куриную грудку и обжарить до румяной корочки.",
        "timer_min": 4,
        "timer_label": "обжаривание первой стороны"
      },
      {
        "text": "Перевернуть куриную грудку, добавить чеснок и продолжить готовить на среднем огне.",
        "timer_min": 6,
        "timer_label": "обжаривание второй стороны"
      },
      {
        "text": "Проверить, что куриная грудка достигла внутренней температуры не ниже 72°C: ввести щуп термометра в самую толстую часть и при необходимости продолжать готовить; не определять готовность только по цвету сока.",
        "timer_note": "Внутренняя температура: 72°C"
      },
      {
        "text": "Снять куриную грудку со сковороды и оставить отдыхать перед нарезкой.",
        "timer_min": 5,
        "timer_label": "отдых"
      }
    ],
    "notes": "Безопасная температура: Для грудки безопасный минимум — 72°C, для бедра — 82°C; использовать термометр, а не только цвет мяса или сока.\n\nПилот sol-chef: A06-poultry-safe-temp, pipeline-B, оценка 4.57",
    "added": "2026-09-05",
    "category": "птица",
    "source_type": "article",
    "source_url": "",
    "source_name": "Pilot source notes A06 + meat-poultry.json",
    "variations": [
      {
        "title": "С куриным бедром",
        "text": "Заменить грудку бескостным куриным бедром и довести его термометром до внутренней температуры не ниже 82°C."
      }
    ]
  }
]
