[
  {
    "id": "korichnevoe-maslo",
    "title": "Коричневое масло (Beurre Noisette)",
    "source_type": "video",
    "source_url": "https://www.youtube.com/watch?v=6aWbZTmuj30",
    "source_name": "Epicurious",
    "tags": ["выпечка", "заготовка", "ореховый вкус", "мороженое"],
    "category": "соусы",
    "summary": "Сливочное масло топят на среднем огне в светлой посуде, непрерывно взбивая венчиком, пока молочные белки не карамелизуются до орехового оттенка и аромата фундука. Получается глубокий жареный вкус для выпечки, соусов и десертов; партию можно готовить заранее и хранить месяцами.",
    "ingredients": [
      { "name": "сливочное масло", "amount": 100, "unit": "г", "detail": "партия любого размера — техника та же", "scalable": true }
    ],
    "steps": [
      "Положить масло в светлую кастрюлю или сотейник — в тёмной посуде не видно степень потемнения.",
      "Топить на среднем огне.",
      "Когда масло расплавится, непрерывно взбивать венчиком: молочные частицы остаются во взвешенном состоянии и не пригорают ко дну.",
      "Продолжать нагрев, пока масло не станет орехового оттенка и не запахнет фундуком. Снять с огня сразу — остаточное тепло ещё темнит.",
      "Перелить в жаропрочную миску вместе с подрумяненными частицами со дна — в них основной вкус."
    ],
    "variations": [
      {
        "title": "Топлёное масло (Ghee / Clarified butter)",
        "text": "<p>На том же этапе, когда молочные белки осели на дно, а сверху прозрачный жёлтый жир, <strong>нагрев останавливают</strong> и сливают чистый жир. Белки не карамелизуют — вкуса фундука не будет, зато жир почти не горит на сильном огне.</p>"
      },
      {
        "title": "Magic Shell для мороженого",
        "text": "<p>Тёплым коричневым маслом полить холодное мороженое — оно мгновенно застывает в хрустящую масляно-ореховую глазурь. Подходит и для рожка, и для шариков в креманке.</p>"
      }
    ],
    "notes": "Масло состоит из молочного жира и сухих молочных веществ (белков). При нагревании белки оседают и карамелизуются — отсюда орехово-жареный вкус. Можно готовить заранее большими объёмами: в холодильнике и морозилке хранится месяцами. В печенье и кексы даёт более глубокий вкус, чем обычное топлёное масло. Таймкод видео: 02:19–04:15.",
    "added": "2026-08-17"
  },
  {
    "id": "aromatizirovannoe-maslo-chili-myod",
    "title": "Ароматизированное масло с чили и мёдом",
    "source_type": "video",
    "source_url": "https://www.youtube.com/watch?v=6aWbZTmuj30",
    "source_name": "Epicurious",
    "tags": ["кукуруза", "заготовка", "остро-сладкое", "чеснок"],
    "category": "соусы",
    "summary": "Составное масло (compound butter): размягчённое сливочное масло смешивают с чесноком, кунжутом, корейским перцем, паприкой и мёдом. Горячую кукурузу или запечённые овощи смазывают сразу; остаток формуют «колбаской» в пергаменте и хранят в холодильнике или морозилке, отрезая медальоны по мере надобности.",
    "prep": [
      { "text": "Достать масло — комнатная температура, чтобы легко смешивалось с добавками", "before_min": 60, "type": "room_temp" }
    ],
    "ingredients": [
      { "name": "сливочное масло", "amount": 100, "unit": "г", "detail": "размягчённое", "scalable": true },
      { "name": "чеснок", "detail": "измельчённый", "scalable": true },
      { "name": "кунжут", "detail": "семена", "scalable": true },
      { "name": "хлопья перца", "detail": "корейский кочукару; если нет — обычные хлопья чили", "scalable": true },
      { "name": "паприка", "scalable": true },
      { "name": "мёд", "scalable": true }
    ],
    "steps": [
      "Смешать размягчённое масло с чесноком, кунжутом, хлопьями перца, паприкой и мёдом до ровного цвета — добавки должны распределиться по всей массе.",
      "Тёплым мягким маслом можно сразу смазать горячую кукурузу или запечённые овощи.",
      "Остаток выложить горкой на лист пергамента или пищевой плёнки, чуть ближе к ближнему краю.",
      "Накрыть верхним краем пергамента, придерживая нижний край, и поджать масло ребром противня или металлической линейкой — получится плотный цилиндр без пустот.",
      "Свернуть рулетом и закрутить концы в противоположные стороны.",
      "Убрать в холодильник или морозилку. Перед подачей отрезать нужные медальоны."
    ],
    "variations": [
      {
        "title": "Солёные и сладкие добавки",
        "text": "<p>Тот же принцип — размягчённое масло плюс любые добавки, которые нравятся:</p><ul><li>свежие травы</li><li>каперсы</li><li>анчоусы</li><li>специи</li></ul><p>Сладкий вариант работает так же, как солёный: главное — равномерно вмешать добавки в тёплое мягкое масло.</p>"
      },
      {
        "title": "Розочки в молдах",
        "text": "<p>Мягкое масло утрамбовать в силиконовые молды (например, в форме розочек), снять излишки ножом вровень с краем, охладить или заморозить, извлечь и перед сервировкой посыпать крупной морской солью.</p>"
      }
    ],
    "notes": "В холодильнике колбаска лежит месяцами, в морозилке ещё дольше. Если масло из холодильника и ждать час нельзя: короткие импульсы в микроволновке по 5–10 секунд на высокой мощности (всего около 20 секунд — не ставить сразу на 20–30, иначе центр станет лужей); трюк с горячим стаканом — налить кипяток, прогреть стенки, вылить, стряхнуть капли и накрыть брусок на тарелке на 10–15 минут; натереть холодное или замороженное масло на крупной тёрке, держа брусок сбоку под углом (стружка согревается за пару минут, тот же приём удобен для ввода холодного масла в муку в сконах и песочном тесте); положить между двумя листами пергамента и расплющить скалкой в тонкий пласт — так же готовят масляные блоки для круассанов. Обёртку от пачки не выбрасывать: на внутренней стороне остаётся жир, ею удобно смазывать формы для кексов, маффинов и противни. Таймкод видео: 04:54–06:46, размягчение 09:47–11:41, подача 12:24–13:19.",
    "added": "2026-08-17"
  },
  {
    "id": "ber-mane",
    "title": "Бёр Манье",
    "source_type": "video",
    "source_url": "https://www.youtube.com/watch?v=6aWbZTmuj30",
    "source_name": "Epicurious",
    "tags": ["подлива", "загуститель", "мука", "экспресс"],
    "category": "соусы",
    "summary": "Beurre manié («размятое масло») — смесь равных частей размягчённого сливочного масла и муки, вымешанная в гладкую пасту. Это экспресс-загуститель для подлив, супов и соусов: пасту вмешивают венчиком в горячую жидкость, и мука не собирается комками. Готовность проверяют тестом nappe по обратной стороне ложки.",
    "prep": [
      { "text": "Достать масло — комнатная температура, чтобы смешалось с мукой в пасту", "before_min": 60, "type": "room_temp" }
    ],
    "ingredients": [
      { "name": "сливочное масло", "amount": 50, "unit": "г", "detail": "размягчённое", "scalable": true },
      { "name": "мука", "amount": 50, "unit": "г", "detail": "равная часть с маслом", "scalable": true },
      { "name": "соус или подлива", "detail": "горячие, слишком жидкие — количество пасты по вкусу", "scalable": false }
    ],
    "steps": [
      "Смешать равные части размягчённого сливочного масла и муки в гладкую пасту.",
      "Вмешать пасту венчиком в горячую подливу, суп или соус. Добавлять понемногу — густоту проще нарастить, чем разбавить.",
      "Проверить готовность тестом nappe: провести пальцем по обратной стороне соусной ложки. Если след остаётся чётким и края не смыкаются — соус загущен правильно."
    ],
    "variations": [
      {
        "title": "Монтирование соуса маслом (Monte au Beurre)",
        "text": "<p>Не загуститель, а финиш: в самом конце вмешать в горячий соус 2–3 холодных кусочка сливочного масла (для пасты, рыбы, мяса). Масло эмульгирует соус, даёт шелковистый глянец, помогает ему держаться на пасте и сглаживает избыточную кислотность — например, у томатов.</p>"
      }
    ],
    "notes": "Паста заранее запечатывает муку в жире, поэтому в горячей жидкости не образуются комки — в отличие от сырой муки, брошенной в соус. Количество бёр манье подбирают по густоте: можно добавить ещё, если след на ложке сразу заплывает. Таймкод видео: 07:04–08:30.",
    "added": "2026-08-17"
  }
]
