[
  {
    "id": "shokoladnyy-fondan",
    "title": "Шоколадный фондан",
    "source_type": "article",
    "source_url": "https://sol-chef.ru",
    "source_name": "Личный повар",
    "tags": [
      "шоколад",
      "быстрое",
      "духовка"
    ],
    "category": "десерт",
    "summary": "Разница между жидким центром и полностью пропечённым кексом — одна-две минуты в духовке, поэтому здесь точность важнее, чем в любом другом рецепте этой подборки. Холодные формочки из холодильника требуют на пару минут больше времени.",
    "ingredients": [
      { "name": "шоколад", "amount": 150, "unit": "г", "detail": "тёмный, измельчённый", "scalable": true },
      { "name": "сливочное масло", "amount": 150, "unit": "г", "detail": "+ дополнительно для смазывания формочек", "scalable": true },
      { "name": "яйца", "amount": 2, "unit": "шт", "detail": "целых + 2 желтка", "scalable": true },
      { "name": "сахар", "amount": 100, "unit": "г", "scalable": true },
      { "name": "мука", "amount": 50, "unit": "г", "scalable": true },
      { "name": "соль", "detail": "щепотка", "scalable": false },
      { "name": "сахарная пудра", "detail": "для подачи", "scalable": false },
      { "name": "ванильное мороженое", "detail": "для подачи", "scalable": false }
    ],
    "steps": [
      "На водяной бане растопить измельчённый шоколад со сливочным маслом до гладкого однородного состояния.",
      "Отдельно взбить 2 яйца и 2 желтка с сахаром до посветления массы и полного растворения сахара.",
      "Формочки (рамекины) тщательно смазать размягчённым сливочным маслом, включая стенки до самого верха.",
      "В яичную смесь просеять муку, добавить щепотку соли, аккуратно перемешать.",
      "Постепенно влить шоколадную массу, аккуратно соединяя лопаткой, стараясь не выбить лишний воздух.",
      "Разлить тесто по формочкам.",
      {
        "text": "Выпекать при 200 °C — 7–8 минут для формочек комнатной температуры или 9–10 минут, если они стояли в холодильнике. Середина должна остаться жидкой.",
        "timer_min": 8,
        "timer_label": "Духовка",
        "timer_note": "Критично ±1–2 мин; холодные формочки +2 мин. Не масштабируется с числом порций"
      },
      "Провести тонким ножом вдоль стенки формочки, перевернуть фондан на тарелку, посыпать сахарной пудрой и подать с ванильным мороженым."
    ],
    "notes": "Смазывать формочки нужно тщательно и до самого верха, включая место у края — непромазанный участок стенки не даст фондану ровно подняться и выскользнуть при перевёртывании. Здесь лишняя минута в духовке не улучшает результат, как в большинстве выпечки, а разрушает его: жидкий центр — не недоготовленность, а сама суть блюда, поэтому таймер важнее визуальной готовности.",
    "added": "2026-07-22"
  }
]
