[
  {
    "id": "stejk-na-skovorode-pan-searing",
    "title": "Стейк на сковороде (Pan-Searing)",
    "source_type": "video",
    "source_url": "https://www.youtube.com/watch?v=rgXtLVFzFmo",
    "source_name": "Andy Cooks",
    "tags": [
      "стейк",
      "гриль",
      "классика",
      "ужин"
    ],
    "category": "говядина",
    "summary": "Метод обжаривания стейков стандартной толщины (рибай, стриплойн, филе-миньон) на раскаленной чугунной сковороде без предварительного доведения мяса до комнатной температуры. Жир вытапливается отдельно, затем стейк обжаривается с частыми переворотами и поливается пенящимся сливочным маслом с розмарином и чесноком до готовности.",
    "ingredients": [
      { "name": "стейк", "detail": "(рибай, стриплойн или филе-миньон) стандартной толщины", "scalable": false },
      { "name": "растительное масло", "scalable": false },
      { "name": "соль", "detail": "обычная или морская мелкого помола", "scalable": false },
      { "name": "сливочное масло", "detail": "несколько кубиков", "scalable": false },
      { "name": "розмарин", "detail": "свежий, пара веточек", "scalable": false },
      { "name": "чеснок", "detail": "неочищенный, раздавленные зубчики", "scalable": false },
      { "name": "черный перец", "detail": "свежемолотый (по подаче)", "scalable": false }
    ],
    "steps": [
      "Разогреть тяжелую чугунную сковороду с растительным маслом.",
      "Щедро посолить стейк со всех сторон, не добавляя черный перец.",
      "Когда масло начнет слегка дымиться, опустить стейк вертикально, прижимая жировой прослойкой вниз, чтобы вытопить жир.",
      "Положить стейк плашмя и переворачивать каждые 30 секунд для равномерной корочки.",
      "После образования золотисто-коричневой корочки добавить в сковороду сливочное масло, розмарин и раздавленный чеснок.",
      "Наклонить сковороду и постоянно поливать стейк пенящимся ароматным маслом.",
      "Контролировать внутреннюю температуру термометром и снять стейк при достижении целевой степени прожарки.",
      {
        "text": "Переложить мясо на решетку, полить оставшимся маслом из сковороды и дать отдохнуть 5 минут перед нарезкой.",
        "timer_min": 5,
        "timer_label": "Отдых",
        "timer_note": "Фиксированный отдых перед нарезкой; не зависит от толщины стейка"
      }
    ],
    "variations": [
      {
        "title": "С зелёным маслом (Beurre Maître d'Hôtel)",
        "text": "Исключить поливание сливочным маслом в сковороде. Накрыть готовый стейк во время 5-минутного отдыха шайбой заранее приготовленного сливочного масла с мелко рубленной петрушкой, щепоткой соли и пару каплями лимонного сока."
      },
      {
        "title": "Перечный стейк (Au Poivre)",
        "text": "Перед обжаркой обвалять стейк в крупно дроблёном чёрном перце горошком. После снятия мяса деглазировать сковороду 50 мл бульона или безалкогольного напитка, влить 50 мл жирных сливок и уварить 2 минуты до густого сливочно-перечного соуса."
      },
      {
        "title": "С тимьяном и шалотом",
        "text": "Заменить розмарин на 3–4 веточки свежего тимьяна и добавить вместе со сливочным маслом 1 мелко нарезанную луковицу шалота."
      },
      {
        "title": "В азиатском стиле",
        "text": "Заменить сливочное масло с розмарином на смесь 1 ст. л. соевого соуса, 1 ч. л. тёртого свежего имбиря и 1 ч. л. кунжутного масла. Сбрызнуть стейк в последние 30 секунд обжарки."
      }
    ],
    "notes": "Ориентиры внутренней температуры снятия с огня: rare 40°C, medium rare 46°C, medium 52°C, medium well 57°C, well done 71°C. Стейки стандартной толщины можно готовить сразу из холодильника, без выдержки при комнатной температуре. Если сковорода перегревается и масло горит — выключить огонь. Таймкоды видео: 01:32-04:33.",
    "added": "2026-07-22"
  },
  {
    "id": "barhatnaya-govyadina-po-kitajski",
    "title": "Бархатная говядина по-китайски",
    "source_type": "article",
    "source_url": "https://sol-chef.ru",
    "source_name": "Личный повар",
    "category": "говядина",
    "tags": ["стир-фрай", "азиатская кухня", "быстро", "ужин"],
    "summary": "Азиатская техника «бархатования» (velveting) позволяет сделать недорогой и жесткий отруб говядины чрезвычайно нежным и сочным. Кратковременное воздействие пищевой соды размягчает мясные волокна, а маринад из крахмала, яичного белка и масла запечатывает соки при молниеносной обжарке на раскаленной сковороде.",
    "ingredients": [
      { "name": "говядина", "amount": 500, "unit": "г", "detail": "лопатка, огузок или бедро", "scalable": true },
      { "name": "пищевая сода", "amount": 0.5, "unit": "ч. л.", "scalable": true, "scale_mode": "gentle" },
      { "name": "яичный белок", "amount": 1, "unit": "шт", "scalable": true, "scale_mode": "whole" },
      { "name": "кукурузный крахмал", "amount": 1, "unit": "ст. л.", "detail": "(10 г)", "scalable": true },
      { "name": "соевый соус", "amount": 2, "unit": "ст. л.", "detail": "(30 мл)", "scalable": true },
      { "name": "растительное масло", "amount": 1, "unit": "ст. л.", "detail": "в маринад", "scalable": true },
      { "name": "растительное масло", "amount": 3, "unit": "ст. л.", "detail": "для жарки", "scalable": true }
    ],
    "steps": [
      "Нарезать говядину тонкими пластинами толщиной около 3 мм строго поперек волокон.",
      "Посыпать мясо содой, тщательно перемешать и оставить на 15 минут при комнатной температуре.",
      "Тщательно промыть говядину в холодной проточной воде, чтобы полностью удалить остатки соды, и хорошо отжать от лишней влаги.",
      "Замариновать мясо: добавить соевый соус, яичный белок и крахмал, перемешать до гладкости, затем влить 1 ст. л. растительного масла.",
      "Сильно разогреть сковороду или вок с растительным маслом на максимальном огне.",
      "Выложить говядину небольшими партиями в один слой и быстро обжаривать в течение 1.5–2 минут, постоянно помешивая, до изменения цвета."
    ],
    "variations": [
      {
        "title": "С болгарским перцем и луком",
        "text": "После обжарки мяса отдельно обжарить на сильном огне 1 репчатый лук и 1 болгарский перец (2 минуты), затем вернуть говядину и прогреть вместе 30 секунд."
      },
      {
        "title": "В черном перечном соусе",
        "text": "В конце приготовления добавить к мясу 1 ч. л. крупно смолотого черного перца, 2 измельченных зубчика чеснока и 1 ст. л. соевого соуса, быстро перемешать."
      },
      {
        "title": "С брокколи в имбирном соусе",
        "text": "Отварить 200 г брокколи 1 минуту в кипятке. Добавить к обжаренной говядине вместе с 0.5 ч. л. натертого имбиря и 50 мл бульона, смешанного с 0.5 ч. л. крахмала."
      }
    ],
    "notes": "Главные секреты техники: нарезка исключительно ПОПЕРЕК волокон и строгое соблюдение времени выдержки в соде (не более 15–20 минут, иначе мясо потеряет текстуру). Добавление растительного масла в конце маринуса не дает ломтикам слипаться при обжарке.",
    "added": "2026-07-22"
  },
  {
    "id": "basting-slivochnym-maslom",
    "title": "Бастинг сливочным маслом",
    "source_type": "video",
    "source_url": "https://www.youtube.com/watch?v=6aWbZTmuj30",
    "source_name": "Epicurious",
    "tags": ["стейк", "корочка", "сковорода", "тимьян"],
    "category": "говядина",
    "summary": "Ароматическое глазирование (butter basting): мясо сначала обжаривают на сильном огне до первичной корочки, затем огонь убавляют и непрерывно поливают пенящимся сливочным маслом с тимьяном или розмарином и раздавленным чесноком. Снаружи получается карамелизированная хрустящая корочка с орехово-сливочным вкусом, внутри мясо остаётся сочным.",
    "ingredients": [
      { "name": "стейк", "detail": "рибай на кости или другой толстый кусок; тот же приём работает со свиными отбивными, курицей, рыбой и морепродуктами", "scalable": false },
      { "name": "сливочное масло", "detail": "щедро — при поливании должно полностью покрывать поверхность", "scalable": false },
      { "name": "тимьян", "detail": "свежие веточки; можно заменить розмарином", "scalable": false },
      { "name": "чеснок", "amount": 1, "unit": "зубчик", "detail": "неочищенный, слегка раздавить; шелуху не снимать — нужен только аромат", "scalable": false },
      { "name": "соль", "detail": "крупная морская, для подачи", "scalable": false }
    ],
    "steps": [
      "Обжарить мясо на сильном огне до появления первичной корочки.",
      "Убавить огонь до среднего — иначе сливочное масло сгорит.",
      "Добавить щедрое количество сливочного масла: его должно хватать, чтобы при поливании полностью покрывать продукт.",
      "Добавить веточки тимьяна или розмарина и слегка раздавленный неочищенный зубчик чеснока.",
      "Наклонить сковороду и столовой ложкой непрерывно поливать мясо пенящимся коричневеющим маслом.",
      "Прекратить поливать, когда корочка станет плотной и золотистой.",
      "Дать мясу отдохнуть, затем нарезать. При подаче можно присыпать крупной морской солью и свежим тимьяном."
    ],
    "notes": "Чеснок в шелухе в сковороду не едят — он только ароматизирует масло. Масла не жалеть: тонкого слоя не хватит, чтобы покрыть поверхность при поливании. Таймкод видео: 00:08–01:26. Полный стейк на сковороде с частыми переворотами — отдельный рецепт «Стейк на сковороде (Pan-Searing)».",
    "added": "2026-08-17"
  }
]
