[
  {
    "id": "govyadina-tushenaya-na-volokna-zamorozka",
    "title": "Shredded Beef — тушёная говядина на волокна (заготовка на заморозку)",
    "source_type": "article",
    "source_url": "https://sol-chef.ru",
    "source_name": "Личный повар",
    "tags": [
      "тушение",
      "казан",
      "заготовка",
      "заморозка",
      "meal prep"
    ],
    "category": "говядина",
    "summary": "Крупный кусок лопатки томится 3.5–4 часа до полного распада коллагена, затем разбирается на волокна и замораживается порциями с соусом — база для тако, супа, пасты, начинки для пирогов на 3–4 недели вперёд. На 2.5–3 кг мяса выходит примерно 1.8–2 кг готового шреда.",
    "prep": [
      {
        "text": "Посолить лопатку и убрать в холодильник без крышки (сухой рассол)",
        "before_hours": 24,
        "type": "fridge"
      },
      {
        "text": "Достать мясо из холодильника, обсушить перед обжаркой",
        "before_min": 30,
        "type": "room_temp"
      }
    ],
    "ingredients": [
      { "name": "говяжья лопатка", "amount": 2.5, "amount_max": 3, "unit": "кг", "detail": "куском (или 2 крупных куска по 1.2–1.5 кг)", "scalable": true },
      { "name": "растительное масло", "detail": "для обжарки", "scalable": false },
      { "name": "лук", "amount": 2, "unit": "шт", "detail": "репчатый, крупно нарезать", "scalable": true },
      { "name": "морковь", "amount": 2, "unit": "шт", "detail": "крупно нарезать", "scalable": true },
      { "name": "чеснок", "amount": 6, "amount_max": 8, "unit": "зубчик", "detail": "раздавить", "scalable": true },
      { "name": "томатная паста", "amount": 2, "amount_max": 3, "unit": "ст. л.", "scalable": true },
      { "name": "красное вино или бальзамический уксус", "amount": 100, "unit": "мл", "detail": "сухое вино или бальзамический уксус, для деглазирования", "scalable": true },
      { "name": "бульон или вода", "amount": 1, "amount_max": 1.2, "unit": "л", "detail": "говяжий бульон или вода", "scalable": true },
      { "name": "соевый соус", "amount": 1, "amount_max": 2, "unit": "ст. л.", "scalable": true },
      { "name": "лавровый лист", "amount": 2, "amount_max": 3, "unit": "шт", "scalable": true },
      { "name": "чёрный перец", "amount": 1, "unit": "ч. л.", "detail": "горошком", "scalable": true },
      { "name": "соль", "detail": "по вкусу, с учётом соевого соуса", "scalable": false }
    ],
    "steps": [
      "Обсушите мясо бумажным полотенцем, разрежьте на 2–3 крупных куска (не мельче 6–8 см) — мелкая нарезка перед долгим тушением теряет сок раньше, чем коллаген успевает распасться.",
      "Обжарьте куски в казане на сильном огне со всех сторон до плотной корки, порциями, не перегружая казан. Не двигайте кусок, пока корка не схватится сама. Выложите мясо.",
      "В этом же жире обжарьте лук, морковь и чеснок 5–7 минут, добавьте томатную пасту и пассеруйте ещё 2 минуты — уходит сырой металлический привкус концентрата.",
      "Влейте вино или уксус, деглазируйте, соскребая прижарки со дна — это концентрированный вкус, не мусор.",
      "Верните мясо в казан, долейте бульон примерно до половины высоты кусков (не покрывая целиком), добавьте соевый соус, лавровый лист и перец.",
      {
        "text": "Доведите до едва заметного кипения, накройте крышкой и тушите на минимальном огне 3.5–4 часа. Ориентир готовности — щуп входит как в масло, а не таймер: у крупного куска на 2.5–3 кг время может отличаться на полчаса в любую сторону.",
        "timer_min": 210,
        "timer_label": "Тушение",
        "timer_note": "Ориентир для 2.5–3 кг; щуп важнее таймера, ±30 мин нормально"
      },
      "Выньте мясо, разберите на волокна двумя вилками или миксером на низкой скорости, пока оно ещё тёплое — так расслаивается легче. Уберите крупные куски жира и хрящи.",
      "Соус процедите, при желании уварите в широком сотейнике до нужной густоты, верните часть соуса к волокнам — без соуса шред суховат уже при первой разморозке.",
      "Разложите по порционным пакетам (300–400 г) с небольшим количеством соуса, разровняйте плоско и заморозьте — плоские пакеты размораживаются в разы быстрее толстых брикетов."
    ],
    "notes": "Лопатка — оптимальный отруб для этой заготовки: достаточно жира и коллагена, чтобы не пересохнуть при повторном замораживании и разогреве, и при этом чистый мясной вкус. Можно заменить 20–30% лопатки на голяшку — она добавит больше желатина и более насыщенный соус, но чуть увеличит время готовки. Кострец нижний или огузок брать не стоит — этим постным отрубам не хватает жира, чтобы остаться сочными после заморозки. При разморозке грейте на слабом огне с добавлением ложки бульона или воды — за время в морозилке волокна теряют часть влаги, и без этого шаг мясо кажется суше, чем сразу после готовки.",
    "added": "2026-07-21"
  }
]
