[
  {
    "id": "losos-v-duhovke-s-limonom-i-ukropom",
    "title": "Лосось в духовке с лимоном и укропом",
    "summary": "Стейк или филе лосося запекается на противне при 190°C без молока, сливок и сыра: только растительное масло, лимон, чеснок и зелень. Ориентир готовности — не ниже 63°C внутри, затем короткий отдых перед подачей.",
    "tags": [
      "лосось",
      "духовка",
      "без молока",
      "ужин"
    ],
    "ingredients": [
      {
        "name": "филе лосося",
        "amount": 400,
        "unit": "г",
        "detail": "стейк или кусок филе толщиной 2,5–3 см",
        "scalable": true,
        "scale_mode": "linear"
      },
      {
        "name": "филе форели",
        "amount": 400,
        "unit": "г",
        "detail": "стейк или кусок филе той же толщины",
        "scalable": true,
        "scale_mode": "linear"
      },
      {
        "name": "оливковое масло",
        "amount": 2,
        "unit": "ст. л."
      },
      {
        "name": "растительное масло",
        "amount": 2,
        "unit": "ст. л."
      },
      {
        "name": "лимон",
        "amount": 1,
        "unit": "шт",
        "detail": "цедра и сок"
      },
      {
        "name": "чеснок",
        "amount": 2,
        "unit": "зубчик",
        "scalable": false
      },
      {
        "name": "укроп",
        "amount": 10,
        "unit": "г",
        "detail": "свежая зелень, мелко нарезать",
        "scalable": false
      },
      {
        "name": "петрушка",
        "amount": 10,
        "unit": "г",
        "detail": "замена укропу",
        "scalable": false
      },
      {
        "name": "соль",
        "scalable": false
      },
      {
        "name": "перец",
        "scalable": false
      }
    ],
    "steps": [
      {
        "text": "Разогреть духовку до 190°C. Застелить противень пергаментом или фольгой."
      },
      {
        "text": "Смешать масло с цедрой и соком лимона, измельчённым чесноком, нарезанной зеленью, солью и перцем. Молочные продукты не использовать."
      },
      {
        "text": "Обсушить филе, выложить на противень и смазать смесью со всех сторон."
      },
      {
        "text": "Запекать около 15 минут (для куска 2,5–3 см ориентир 12–18 минут), пока в самой толстой части не будет не ниже 63°C.",
        "timer_min": 15,
        "timer_label": "Запекание",
        "timer_note": "Внутренняя температура: 63°C"
      },
      {
        "text": "Вынуть противень и дать рыбе отдохнуть 2–3 минуты, затем подавать.",
        "timer_min": 3,
        "timer_label": "Отдых"
      }
    ],
    "notes": "Рецепт без сливочного масла, сливок, сыра, молока и сметаны. Лосось или форель из супермаркета. Источник — учебные заметки пилота, не дословная копия чужого текста.\n\nТолстая часть решает: Время — только ориентир. Готовность проверяйте термометром в самом толстом месте, а не по цвету поверхности.\n\nАллергены: fish\n\nПилот sol-chef: A02-red-fish-oven-dairy-free, pipeline-A, оценка 4.86",
    "added": "2026-09-05",
    "category": "рыба",
    "source_type": "article",
    "source_url": "",
    "source_name": "Pilot source notes A02",
    "variations": [
      {
        "title": "В пергаментном конверте",
        "text": "Завернуть смазанное филе в пергамент и запекать в том же режиме: мякоть останется сочнее, состав и аллергены не меняются."
      }
    ]
  },
  {
    "id": "sudak-v-duhovke-s-limonom",
    "title": "Судак в духовке с лимоном",
    "summary": "Бюджетный судак, запечённый на противне с луком, лимоном и укропом; готовность проверяется термометром в самой толстой части рыбы.",
    "tags": [
      "речная рыба",
      "духовка",
      "бюджетный"
    ],
    "ingredients": [
      {
        "name": "Судак",
        "amount": 900,
        "unit": "г",
        "detail": "целиком, очищенный и потрошёный",
        "scalable": true,
        "scale_mode": "whole"
      },
      {
        "name": "Лук",
        "amount": 2,
        "unit": "шт",
        "scalable": true,
        "scale_mode": "linear"
      },
      {
        "name": "Лимон",
        "amount": 1,
        "unit": "шт",
        "scalable": true,
        "scale_mode": "gentle"
      },
      {
        "name": "Растительное масло",
        "amount": 2,
        "unit": "ст. л.",
        "scalable": true,
        "scale_mode": "gentle"
      },
      {
        "name": "Укроп",
        "amount": 1,
        "unit": "пучок",
        "scalable": true,
        "scale_mode": "gentle"
      },
      {
        "name": "Лавровый лист",
        "amount": 2,
        "unit": "шт",
        "scalable": true,
        "scale_mode": "gentle"
      },
      {
        "name": "Соль",
        "scalable": false
      },
      {
        "name": "Чёрный перец",
        "scalable": false
      }
    ],
    "steps": [
      {
        "text": "Разогреть духовку до 190°C. Судака промыть, обсушить, посолить и поперчить снаружи и внутри."
      },
      {
        "text": "Нарезать лук и половину лимона; вложить в брюшко судака часть лука, лимон и укроп."
      },
      {
        "text": "Выложить оставшийся лук на противень, поместить сверху судака, смазать растительным маслом и при желании добавить лавровый лист."
      },
      {
        "text": "Запекать судака до готовности.",
        "timer_min": 25,
        "timer_label": "запекание"
      },
      {
        "text": "Проверить термометром самую толстую часть судака у хребта: внутренняя температура должна быть не ниже 63°C.",
        "timer_note": "Внутренняя температура: 63°C"
      },
      {
        "text": "Подать судака с оставшимся лимоном; при разделке аккуратно удалить кости."
      }
    ],
    "notes": "Кости: Речная рыба может быть костистее морской: предупреждать едоков и отделять филе от хребта небольшими порциями.\n\nАллергены: fish\n\nПилот sol-chef: A03-river-fish-bake-or-grill, pipeline-B, оценка 4.86",
    "added": "2026-09-05",
    "category": "рыба",
    "source_type": "article",
    "source_url": "",
    "source_name": "Редакция sol-chef (пилот, AI-assisted)",
    "variations": [
      {
        "title": "Речная форель",
        "text": "Заменить судака речной форелью того же веса и так же проверить температуру в самой толстой части."
      }
    ]
  }
]
