[
  {
    "id": "shakshuka-s-tomatami-i-bazilikom",
    "title": "Шакшука с томатами и базиликом",
    "source_type": "article",
    "source_url": "https://sol-chef.ru",
    "source_name": "Личный повар",
    "tags": [
      "яйца",
      "шакшука",
      "томаты",
      "быстрое"
    ],
    "category": "завтрак",
    "summary": "Ближневосточное блюдо из яиц, сваренных в густом соусе из спелых томатов, чеснока и специй с пряным ароматом свежего базилика. Главный секрет — уварить соус до густоты перед выкладыванием яиц.",
    "ingredients": [
      { "name": "яйца", "amount": 3, "unit": "шт", "scalable": true },
      { "name": "помидоры", "amount": 300, "unit": "г", "detail": "нарезать кубиком", "scalable": true },
      { "name": "томатная паста", "amount": 1, "unit": "ст. л.", "scalable": true },
      { "name": "чеснок", "amount": 2, "unit": "зубчика", "detail": "измельчить", "scalable": true },
      { "name": "базилик свежий", "detail": "несколько веточек", "scalable": false },
      { "name": "оливковое масло", "amount": 1, "unit": "ст. л.", "scalable": true },
      { "name": "зира", "amount": 0.5, "unit": "ч. л.", "scalable": true },
      { "name": "соль", "scalable": false },
      { "name": "чёрный перец", "scalable": false }
    ],
    "steps": [
      "Разогреть оливковое масло в глубокой сковороде на среднем огне и обжарить измельчённый чеснок с зирой в течение 1 минуты до появления аромата.",
      "Добавить нарезанные помидоры и томатную пасту, посолить и поперчить.",
      "Тушить соус на среднем огне 8–10 минут, периодически помешивая, пока томаты не размягчатся и масса не загустеет.",
      "Сделать ложкой 3 углубления в соусе и аккуратно выпустить в них яйца.",
      "Накрыть сковороду крышкой, уменьшить огонь до слабого и готовить 4–6 минут (белок должен полностью побелеть, а желток остаться жидким).",
      "Снять с огня, посыпать мелко нарезанным свежим базиликом и подавать со свежим хлебом."
    ],
    "variations": [
      {
        "title": "С беконом",
        "text": "<p>Перед добавлением чеснока обжарьте на сковороде 50 г нарезанного бекона до легкой хрустящей корочки. Вытопленный жир придаст соусу насыщенный дымный вкус.</p>"
      },
      {
        "title": "С кабачками",
        "text": "<p>Добавьте 100 г кабачков, нарезанных мелкими кубиками, вместе с помидорами. Кабачки сделают соус более объёмным и сочным.</p>"
      },
      {
        "title": "С сыром фета или брынзой",
        "text": "<p>За 2 минуты до готовности покрошите поверх томатного соуса 40–50 г феты или брынзы.</p>"
      }
    ],
    "notes": "Не пересушите яйца: белок схватывается быстро под крышкой, поэтому важно снять сковороду с плиты, пока желток ещё подвижен.",
    "added": "2026-07-22"
  },
  {
    "id": "frittata-s-kabachkami-i-bekonom",
    "title": "Фриттата с кабачками и беконом",
    "source_type": "article",
    "source_url": "https://sol-chef.ru",
    "source_name": "Личный повар",
    "tags": [
      "яйца",
      "фриттата",
      "кабачки",
      "запекание"
    ],
    "category": "завтрак",
    "summary": "Пышный итальянский омлет с обжаренными кабачками, хрустящим беконом и сыром. Сначала овощи и бекон обжариваются на сковороде, а затем заливаются яичной смесью и доводятся до готовности в духовке при 180 °C.",
    "ingredients": [
      { "name": "яйца", "amount": 4, "unit": "шт", "scalable": true },
      { "name": "кабачки", "amount": 150, "unit": "г", "detail": "тонкими кружочками", "scalable": true },
      { "name": "бекон", "amount": 60, "unit": "г", "detail": "нарезать полосками", "scalable": true },
      { "name": "сыр", "amount": 40, "unit": "г", "detail": "твёрдый или полутвёрдый, натёртый", "scalable": true },
      { "name": "базилик свежий", "detail": "для подачи", "scalable": false },
      { "name": "соль", "scalable": false },
      { "name": "чёрный перец", "scalable": false }
    ],
    "steps": [
      "Разогреть духовку до 180 °C.",
      "Выложить бекон на сухую сковороду (пригодную для духовки) и обжарить на среднем огне 3–4 минуты до вытапливания жира.",
      "Добавить кабачки к бекону и обжаривать 4–5 минут до мягкости и легкого золотистого цвета.",
      "В отдельной миске взбить яйца с солью, перцем и половиной тёртого сыра.",
      "Залить яичной смесью кабачки с беконом, равномерно распределив содержимое сковороды.",
      "Готовить на плите на слабом огне 2–3 минуты, чтобы края фриттаты начали схватываться.",
      "Посыпать оставшимся сыром и переставить сковороду в духовку на 8–10 минут до полного запекания яичной массы.",
      "Украсить свежим базиликом и нарезать на порционные дольки."
    ],
    "variations": [
      {
        "title": "Без духовки (на сковороде)",
        "text": "<p>Если нет возможности использовать духовку, накройте сковороду плотной крышкой и томите фриттату на минимальном огне 8–10 минут до готовности верхнего слоя.</p>"
      },
      {
        "title": "С томатами и моцареллой",
        "text": "<p>Выложите поверх яичной массы перед запеканием несколько четвертинок свежих помидоров и 50 г мини-моцареллы.</p>"
      }
    ],
    "notes": "Если сковорода без съемной ручки или не подходит для духовки, обжаренные кабачки с беконом можно переложить в форму для запекания, залив яйцами с сыром.",
    "added": "2026-07-22"
  },
  {
    "id": "tost-s-yajtsom-pashot-bekonom-i-salsoj",
    "title": "Тост с яйцом пашот, беконом и томатно-базиликовой сальсой",
    "source_type": "article",
    "source_url": "https://sol-chef.ru",
    "source_name": "Личный повар",
    "tags": [
      "яйца",
      "пашот",
      "тосты",
      "бекон"
    ],
    "category": "завтрак",
    "summary": "Хрустящий тост с обжаренным беконом, свежей сальсой из спелых томатов и базилика, увенчанный нежным яйцом пашот с жидким желтком, выполняющим роль соуса.",
    "ingredients": [
      { "name": "яйца", "amount": 2, "unit": "шт", "scalable": true },
      { "name": "хлеб", "amount": 2, "unit": "ломтика", "detail": "для тостов или тартин", "scalable": true },
      { "name": "бекон", "amount": 4, "unit": "полоски", "scalable": true },
      { "name": "помидоры", "amount": 1, "unit": "шт", "detail": "нарезать мелкими кубиками", "scalable": true },
      { "name": "базилик свежий", "amount": 5, "unit": "листиков", "detail": "мелко нарезать", "scalable": false },
      { "name": "оливковое масло", "amount": 1, "unit": "ч. л.", "scalable": true },
      { "name": "уксус 9%", "amount": 1, "unit": "ст. л.", "detail": "для варки яиц", "scalable": false },
      { "name": "соль", "scalable": false },
      { "name": "чёрный перец", "scalable": false }
    ],
    "steps": [
      "Смешать в миске нарезанный кубиками помидор, рубленый базилик, оливковое масло, щепотку соли и перца для томатной сальсы.",
      "Обжарить полоски бекона на сухой сковороде по 2–3 минуты с каждой стороны до хрустящей корочки, переложить на бумажное полотенце.",
      "Подрумянить ломтики хлеба в тостере или на сухой сковороде.",
      "В небольшом сотейнике вскипятить воду, уменьшить огонь до слабого кипения, добавить уксус и щепотку соли.",
      "Ложкой закрутить воронку в воде и аккуратно вылить яйцо в центр. Варить ровно 3 минуты.",
      "Достать яйцо шумовкой и выложить на бумажное полотенце, чтобы убрать лишнюю воду.",
      "Собрать тост: на хлеб выложить бекон, томатную сальсу с базиликом и сверху яйцо пашот."
    ],
    "variations": [
      {
        "title": "С обжаренными кабачками",
        "text": "<p>Нарежьте кабачок тонкими слайсами и обжарьте на сковороде после бекона по 1–2 минуты с каждой стороны. Выложите слайсы кабачка подушкой под бекон.</p>"
      },
      {
        "title": "С яйцом-глазуньей",
        "text": "<p>Если не хочется варить пашот, пожарьте классическую глазунью с жидким желтком на той же сковороде, где жарился бекон.</p>"
      }
    ],
    "notes": "Уксус помогает белку быстрее свёртываться и держать форму в воде. Чтобы пашот получился аккуратным, используйте только самые свежие яйца.",
    "added": "2026-07-22"
  },
  {
    "id": "vzbitoe-slivochnoe-maslo",
    "title": "Взбитое сливочное масло",
    "source_type": "video",
    "source_url": "https://www.youtube.com/watch?v=6aWbZTmuj30",
    "source_name": "Epicurious",
    "tags": ["панкейки", "намазка", "тосты", "вафли"],
    "category": "завтрак",
    "summary": "Размягчённое сливочное масло взбивают до пышной лёгкой массы: воздух внутри делает текстуру ультра-намазываемой. Такое масло тает быстрее и равномернее обычного бруска и лучше всего подходит для утренней подачи — панкейки, вафли, тосты.",
    "prep": [
      { "text": "Достать масло — комнатная температура, иначе не взобьётся в пышную массу", "before_min": 60, "type": "room_temp" }
    ],
    "ingredients": [
      { "name": "сливочное масло", "amount": 100, "unit": "г", "detail": "размягчённое", "scalable": true }
    ],
    "steps": [
      "Взбить размягчённое масло венчиком или миксером до пышной светлой массы — масло должно насытиться воздухом.",
      "Подавать сразу к панкейкам, вафлям или тостам: не жалеть, оно тает быстрее обычного бруска."
    ],
    "variations": [
      {
        "title": "Влагозащита сэндвичей",
        "text": "<p>Тонкий слой сливочного масла на хлебе создаёт гидрофобный барьер и не даёт мякишу размокнуть от влажных начинок и овощей. Майонез со временем наоборот отсыревает хлеб. Тот же принцип — у французского jambon-beurre и английских tea sandwiches.</p>"
      }
    ],
    "notes": "Если масло из холодильника: микроволновка короткими импульсами по 5–10 секунд на высокой мощности (всего около 20 секунд); горячий стакан — прогреть кипятком, вылить воду, накрыть брусок на 10–15 минут; натереть на крупной тёрке; расплющить скалкой между двумя листами пергамента. Таймкод видео: 09:08–09:18, сэндвичи 12:45.",
    "added": "2026-08-17"
  }
]