[
  {
    "id": "salat-s-syrom-i-gretskimi-orehami",
    "title": "Салат с сыром и грецкими орехами",
    "summary": "Салатный микс с огурцом, твёрдым сыром и грецкими орехами или миндалём, заправка из оливкового масла, лимонного сока и горчицы. Орехи слегка подсушивают на сухой сковороде. В составе аллергены: орехи, молоко, горчица.",
    "tags": [
      "салат",
      "вегетарианский",
      "закуска"
    ],
    "ingredients": [
      {
        "name": "Салатный микс",
        "amount": 150,
        "amount_max": 200,
        "unit": "г",
        "detail": "листья салата или готовый микс",
        "scalable": true,
        "scale_mode": "linear"
      },
      {
        "name": "Огурец",
        "amount": 1,
        "unit": "шт",
        "detail": "средний, ломтиками",
        "scalable": true,
        "scale_mode": "gentle"
      },
      {
        "name": "Помидоры",
        "amount": 150,
        "unit": "г",
        "detail": "вместо огурца",
        "scalable": true,
        "scale_mode": "gentle"
      },
      {
        "name": "Сыр твёрдый",
        "amount": 40,
        "amount_max": 60,
        "unit": "г",
        "detail": "натереть",
        "scalable": true,
        "scale_mode": "gentle"
      },
      {
        "name": "Грецкие орехи",
        "amount": 30,
        "unit": "г",
        "detail": "грубо порубить",
        "scalable": true,
        "scale_mode": "gentle"
      },
      {
        "name": "Миндаль",
        "amount": 30,
        "unit": "г",
        "detail": "грубо порубить, вместо грецких орехов",
        "scalable": true,
        "scale_mode": "gentle"
      },
      {
        "name": "Оливковое масло",
        "amount": 2,
        "unit": "ст. л.",
        "scalable": true,
        "scale_mode": "gentle"
      },
      {
        "name": "Лимон",
        "amount": 1,
        "unit": "шт",
        "detail": "сок для заправки",
        "scalable": true,
        "scale_mode": "gentle"
      },
      {
        "name": "Уксус",
        "amount": 15,
        "unit": "мл",
        "detail": "вместо лимонного сока",
        "scalable": true,
        "scale_mode": "gentle"
      },
      {
        "name": "Горчица",
        "amount": 1,
        "unit": "ч. л.",
        "scalable": false
      },
      {
        "name": "Соль",
        "scalable": false
      },
      {
        "name": "Перец",
        "scalable": false
      }
    ],
    "steps": [
      {
        "text": "Грецкие орехи или миндаль слегка подсушить на сухой сковороде 2–3 минуты, помешивая, затем остудить и грубо порубить.",
        "timer_min": 3,
        "timer_label": "подсушивание орехов"
      },
      {
        "text": "Салатный микс выложить в миску. Добавить огурец или помидоры. Натереть сыр твёрдый."
      },
      {
        "text": "Смешать заправку: оливковое масло, сок лимона или уксус, горчица, соль и перец."
      },
      {
        "text": "Соединить салатный микс, овощ, сыр и рубленые грецкие орехи или миндаль. Заправить и сразу подать."
      }
    ],
    "notes": "Короткое подсушивание: Орехи на сухой сковороде только до аромата, не до жжения: 2–3 минуты достаточно. Для варианта без орехов те же семечки тыквы прогревают так же.\n\nАллергены: tree_nut, milk, mustard\n\nПилот sol-chef: A05-salad-allergens-swap, pipeline-A, оценка 4.86",
    "added": "2026-09-05",
    "source_type": "article",
    "source_url": "",
    "source_name": "Pilot source notes A05",
    "variations": [
      {
        "title": "Без орехов",
        "text": "Заменить грецкие орехи и миндаль тыквенными семечками (30 г), подсушенными на той же сухой сковороде. Аллерген tree_nut из базового состава уходит; молоко и горчица остаются."
      },
      {
        "title": "Без сыра",
        "text": "Не добавлять сыр; увеличить порцию огурца или помидоров. Аллерген milk уходит; tree_nut и mustard остаются."
      }
    ]
  }
]
