[
  {
    "id": "ovoshchnoy-sup-s-fasolyu",
    "title": "Овощной суп с фасолью",
    "summary": "Сытный вегетарианский суп из картофеля, моркови, лука, помидоров и консервированной фасоли. Всё варится в одной кастрюле на воде, без мясного и рыбного бульона, за 35–40 минут.",
    "tags": [
      "вегетарианский",
      "бюджетный"
    ],
    "ingredients": [
      {
        "name": "Фасоль консервированная",
        "amount": 400,
        "unit": "г",
        "detail": "белая или красная, можно вместе с жидкостью",
        "scalable": true,
        "scale_mode": "linear"
      },
      {
        "name": "Картофель",
        "amount": 400,
        "unit": "г",
        "detail": "очищенный, кубиками",
        "scalable": true,
        "scale_mode": "linear"
      },
      {
        "name": "Лук",
        "amount": 1,
        "unit": "шт",
        "scalable": true,
        "scale_mode": "gentle"
      },
      {
        "name": "Морковь",
        "amount": 1,
        "unit": "шт",
        "detail": "средняя",
        "scalable": true,
        "scale_mode": "gentle"
      },
      {
        "name": "Помидоры",
        "amount": 300,
        "unit": "г",
        "detail": "свежие, нарезанные, либо аналог из банки без мяса",
        "scalable": true,
        "scale_mode": "gentle"
      },
      {
        "name": "Томатное пюре",
        "amount": 2,
        "unit": "ст. л.",
        "detail": "вместо свежих помидоров",
        "scalable": true,
        "scale_mode": "gentle"
      },
      {
        "name": "Чеснок",
        "amount": 2,
        "unit": "зубчик",
        "scalable": true,
        "scale_mode": "gentle"
      },
      {
        "name": "Растительное масло",
        "amount": 2,
        "unit": "ст. л.",
        "scalable": true,
        "scale_mode": "gentle"
      },
      {
        "name": "Лавровый лист",
        "amount": 1,
        "unit": "шт",
        "scalable": false
      },
      {
        "name": "Вода",
        "amount": 1.2,
        "unit": "л",
        "scalable": true,
        "scale_mode": "gentle"
      },
      {
        "name": "Соль",
        "scalable": false
      },
      {
        "name": "Перец",
        "scalable": false
      }
    ],
    "steps": [
      {
        "text": "Нарезать лук, морковь и картофель. Чеснок порубить. Помидоры нарезать (если выбран этот вариант) либо отмерить томатное пюре."
      },
      {
        "text": "В кастрюле разогреть растительное масло. Пассеровать лук и морковь 5–7 минут, добавить чеснок на 30 секунд.",
        "timer_min": 7,
        "timer_label": "пассерование овощей"
      },
      {
        "text": "Добавить картофель, помидоры или томатное пюре, лавровый лист и воду. Довести до кипения, посолить. Варить 15 минут.",
        "timer_min": 15,
        "timer_label": "варка картофеля"
      },
      {
        "text": "Добавить фасоль. Варить ещё 10–12 минут, пока картофель не станет мягким. Поперчить, снять лавровый лист, подать из той же кастрюли.",
        "timer_min": 12,
        "timer_label": "прогрев фасоли"
      }
    ],
    "notes": "Без мясного, куриного и рыбного бульона. Крупу не использовали, чтобы не вносить глютен; сыр и сметану в базовый состав не клали.\n\nОдна кастрюля: Не перекладывать овощи в сковороду: пассерование и варка идут в той же кастрюле. Бульон только водяной — без мяса, курицы и рыбы.\n\nПилот sol-chef: A04-veg-soup-one-pot, pipeline-A, оценка 4.86",
    "added": "2026-09-05",
    "category": "суп",
    "source_type": "article",
    "source_url": "",
    "source_name": "Редакция sol-chef (пилот, AI-assisted)",
    "variations": [
      {
        "title": "Со сметаной",
        "text": "При подаче добавить по 1 ст. л. сметаны в тарелку. Базовый суп без молочных продуктов; эта подача добавляет молоко как аллерген и снимает веганскую маркировку."
      }
    ]
  }
]
