[
  {
    "id": "baranya-lopatka-tushenaya-s-lukom-shalot",
    "title": "Тушёная баранья лопатка с луком-шалот",
    "source_type": "article",
    "source_url": "https://sol-chef.ru",
    "source_name": "Личный повар",
    "tags": [
      "тушение",
      "духовка",
      "шалот",
      "долгое"
    ],
    "category": "баранина",
    "summary": "Очень низкая духовка (80–100 °C) на 7 часов вместо привычных 150 °C на 3 часа — жидкость намеренно не покрывает жировую корку мяса, чтобы она не разварилась, а карамелизовалась сверху. Шалот и соус готовятся отдельно и собираются в самом конце.",
    "ingredients": [
      { "name": "баранья лопатка", "amount": 1.5, "amount_max": 2, "unit": "кг", "detail": "(или говядина)", "scalable": true },
      { "name": "лук", "amount": 2, "unit": "шт", "detail": "репчатый, четвертинками", "scalable": true },
      { "name": "морковь", "amount": 2, "unit": "шт", "detail": "крупно нарезать", "scalable": true },
      { "name": "тимьян", "detail": "свежий, несколько веточек", "scalable": false },
      { "name": "чёрный перец", "scalable": false },
      { "name": "соль", "scalable": false },
      { "name": "бульон", "amount": 500, "amount_max": 700, "unit": "мл", "detail": "куриный", "scalable": true },
      { "name": "бальзамический уксус", "amount": 2, "unit": "ст. л.", "scalable": true },
      { "name": "бальзамический уксус", "amount": 1, "unit": "ст. л.", "detail": "для шалота", "scalable": true },
      { "name": "кукурузный крахмал", "amount": 1, "unit": "ст. л.", "detail": "разведённый в воде", "scalable": true },
      { "name": "лук-шалот", "amount": 6, "amount_max": 8, "unit": "шт", "detail": "разрезать пополам", "scalable": true },
      { "name": "сливочное и оливковое масло", "detail": "для шалота", "scalable": false }
    ],
    "steps": [
      "Сделать насечки на жировой стороне лопатки.",
      "В жаровне (Dutch oven) обжарить мясо со всех сторон до румяной корки, извлечь.",
      "В том же жире обжарить лук и морковь, затем слить лишний вытопившийся жир.",
      "Вернуть мясо и овощи в жаровню, мясо жиром вверх, добавить тимьян и чёрный перец.",
      "Влить бальзамический уксус, выпарить 30 секунд, убирая резкую кислинку.",
      "Влить куриный бульон так, чтобы он не доходил до жировой корки мяса — она должна остаться над жидкостью.",
      {
        "text": "Накрыть крышкой и готовить в духовке при 80–100 °C до полной мягкости.",
        "timer_min": 420,
        "timer_label": "Духовка, тушение",
        "timer_note": "Для 1.5–2 кг при 80–100 °C; мягкость важнее времени"
      },
      {
        "text": "Отдельно: обжарить половинки шалота срезом вниз в смеси масел с тимьяном, добавить бальзамический уксус, накрыть картушем из пергамента и запекать при 180 °C.",
        "timer_min": 16,
        "timer_label": "Шалот в духовке",
        "timer_note": "Отдельный процесс для шалота; не связан с объёмом мяса"
      },
      "Процедить оставшийся от мяса бульон через сито, довести до кипения, загустить разведённым в воде крахмалом до нужной консистенции.",
      "Выложить мясо с шалотом на тарелку и полить соусом."
    ],
    "notes": "Жировая корка сознательно остаётся над уровнем бульона — если её залить целиком, она сварится и станет резиновой вместо того, чтобы медленно карамелизоваться сверху за 7 часов. Бальзамический уксус выпаривают отдельно 30 секунд перед бульоном — резкая кислотность уксуса уходит с паром, а сладковатая глубина остаётся и не забивает вкус мяса за долгие часы тушения.",
    "added": "2026-07-22"
  }
]
